{
  "schemaVersion": 1,
  "domain": "ops",
  "generatedAt": "2026-08-06T08:30:53.534Z",
  "ok": true,
  "reason": null,
  "sources": [
    {
      "id": "service-registry-reader",
      "kind": "canonical-reader",
      "path": "src/lib/service-registry.js",
      "ok": true,
      "observedAt": "2026-08-04T16:10:25.833Z",
      "reason": null
    },
    {
      "id": "service-registry",
      "kind": "canonical-config",
      "path": "config/service-registry.json",
      "ok": true,
      "observedAt": null,
      "reason": null
    },
    {
      "id": "live-agent-preflight",
      "kind": "live-cli",
      "path": "tools/agent-preflight.js",
      "ok": true,
      "observedAt": "2026-08-06T08:30:53.590Z",
      "reason": null
    },
    {
      "id": "live-message-reader",
      "kind": "live-reader",
      "path": "state/",
      "ok": false,
      "observedAt": null,
      "reason": "source-unreadable-safely"
    }
  ],
  "data": {
    "declaredServices": [
      {
        "id": "dashboard",
        "displayName": "Agent Activity Dashboard",
        "transport": "http",
        "port": 3889,
        "resolution": "loopback"
      },
      {
        "id": "full-remote-access",
        "displayName": "Full Remote Access (FRA)",
        "transport": "fra-secure-session",
        "port": 8790,
        "resolution": "peer"
      },
      {
        "id": "jarvis-local-coder",
        "displayName": "JARVIS local-coder sidecar",
        "transport": "http",
        "port": 3888,
        "resolution": "loopback"
      },
      {
        "id": "local-link-bus-diagnostic",
        "displayName": "This machine's own link-bus listener (diagnostic only)",
        "transport": "http",
        "port": 8787,
        "resolution": "self"
      },
      {
        "id": "local-peer-tool-bridge-diagnostic",
        "displayName": "This machine's own peer-tool-bridge listener (diagnostic only)",
        "transport": "mcp-jsonrpc-over-tcp",
        "port": 8788,
        "resolution": "self"
      },
      {
        "id": "peer-tool-bridge",
        "displayName": "Peer tool bridge (Bridge)",
        "transport": "mcp-jsonrpc-over-tcp",
        "port": 8788,
        "resolution": "peer"
      },
      {
        "id": "shared-agent-bus",
        "displayName": "Shared agent bus (Tunnel)",
        "transport": "http",
        "port": 8787,
        "resolution": "fixed"
      }
    ],
    "channels": {
      "ok": true,
      "reason": null,
      "observedAt": "2026-08-06T08:30:53.590Z",
      "value": [
        {
          "id": "channel-health-observer-snapshot",
          "name": "health-observer snapshot",
          "state": "stale",
          "observedAt": "2026-08-04T01:01:23.590Z",
          "detail": "11 subsystems, but the observer itself is stale — this whole snapshot is untrustworthy"
        },
        {
          "id": "channel-linkbus-8787",
          "name": "linkBus (:8787)",
          "state": "healthy",
          "observedAt": "2026-08-06T08:30:08.590Z",
          "detail": "owned · healthy"
        },
        {
          "id": "channel-remotebridge-8788",
          "name": "remoteBridge (:8788)",
          "state": "conflict",
          "observedAt": "2026-08-06T08:30:08.590Z",
          "detail": "conflict · healthy — listener identity mismatch"
        },
        {
          "id": "channel-fra-8790",
          "name": "FRA (:8790)",
          "state": "healthy",
          "observedAt": "2026-08-04T11:17:36.590Z",
          "detail": "owned · healthy · operational"
        },
        {
          "id": "channel-rendezvous-8795",
          "name": "rendezvous (:8795)",
          "state": "unknown",
          "observedAt": "2026-08-03T05:35:13.590Z",
          "detail": "role receiver · committed key generation 9"
        }
      ]
    },
    "mcp": {
      "ok": true,
      "reason": null,
      "observedAt": "2026-08-06T08:30:53.590Z",
      "value": {
        "live": [
          "toolsenabled-readonly",
          "playwright",
          "toolsenabled-remote",
          "toolsenabled-full-remote"
        ],
        "dead": [
          "toolsenabled"
        ]
      }
    },
    "messages": {
      "ok": false,
      "reason": "source-unreadable-safely",
      "observedAt": null,
      "value": null
    }
  }
}
